experiment_id	run_tag	candidate_family	status	decision	relative_mae	relative_rmse	worst_fold_rmse_ratio	peak_vram_mb	training_seconds	recorded_at
exp_1785794034542	sweep-QQQ-h20	dlinear	success	discard	1.7241044590605896	1.8320737087313008	2.8433264252845105	0	0.0	2026-08-03T21:53:54.542210+00:00
exp_1785794034792	sweep-QQQ-h20	small_tcn	success	keep	0.8569166419327856	0.8731986761406344	0.9998580982477395	0	0.0	2026-08-03T21:53:54.792788+00:00
exp_1785794037917	sweep-MSFT-h1	persistence	success	discard	1.0	1.0	1.0	0	0.0	2026-08-03T21:53:57.917382+00:00
exp_1785794038013	sweep-MSFT-h1	ridge	success	discard	0.9869564564888335	0.9939657670843278	1.0105303502287912	0	0.0	2026-08-03T21:53:58.013206+00:00
exp_1785794038087	sweep-MSFT-h1	elastic_net	success	discard	0.9976810999460137	0.9971215540689072	1.0011793629063708	0	0.0	2026-08-03T21:53:58.087467+00:00
exp_1785794044482	sweep-MSFT-h1	compact_mlp	success	discard	2.7661772618667815	2.7475741638116267	4.749943057877511	0	0.0	2026-08-03T21:54:04.482885+00:00
exp_1785794045345	sweep-MSFT-h1	dlinear	success	discard	2.147172614166115	1.8907718505460134	2.3682514767397604	0	0.0	2026-08-03T21:54:05.345482+00:00
exp_1785794045551	sweep-MSFT-h1	small_tcn	success	discard	0.9920532538835047	0.9982593602477328	1.0089257938503076	0	0.0	2026-08-03T21:54:05.551336+00:00
exp_1785794048433	sweep-MSFT-h3	persistence	success	discard	1.0	1.0	1.0	0	0.0	2026-08-03T21:54:08.433086+00:00
exp_1785794048529	sweep-MSFT-h3	ridge	success	discard	0.981206481177866	0.9943729144553461	1.0301531331079876	0	0.0	2026-08-03T21:54:08.529513+00:00
exp_1785794048613	sweep-MSFT-h3	elastic_net	success	discard	0.9846824605634803	0.9732341952317551	1.02055666626261	0	0.0	2026-08-03T21:54:08.613313+00:00
exp_1785794054565	sweep-MSFT-h3	compact_mlp	success	discard	2.2268044942753087	1.9400284373940555	3.8034026234874676	0	0.0	2026-08-03T21:54:14.565707+00:00
exp_1785794055413	sweep-MSFT-h3	dlinear	success	discard	1.8934631762438223	1.8105855077632538	2.289484183705941	0	0.0	2026-08-03T21:54:15.413435+00:00
exp_1785794055617	sweep-MSFT-h3	small_tcn	success	discard	0.9955129200097824	1.0027335610029495	1.026691634833135	0	0.0	2026-08-03T21:54:15.617479+00:00
exp_1785794058642	sweep-MSFT-h5	persistence	success	discard	1.0	1.0	1.0	0	0.0	2026-08-03T21:54:18.642498+00:00
exp_1785794058742	sweep-MSFT-h5	ridge	success	discard	0.9875985523997675	0.981905368130416	1.035153229651252	0	0.0	2026-08-03T21:54:18.742749+00:00
exp_1785794058810	sweep-MSFT-h5	elastic_net	success	discard	0.9846014001373798	0.9773694655772235	1.0148280872050224	0	0.0	2026-08-03T21:54:18.810352+00:00
exp_1785794065355	sweep-MSFT-h5	compact_mlp	success	discard	1.87306200154166	1.7796713724518571	3.368578231281492	0	0.0	2026-08-03T21:54:25.355774+00:00
exp_1785794066265	sweep-MSFT-h5	dlinear	success	discard	1.7594487389812272	1.6791159443575796	2.4210773262537493	0	0.0	2026-08-03T21:54:26.265437+00:00
exp_1785794066481	sweep-MSFT-h5	small_tcn	success	discard	0.9790120493318034	0.9814785057735158	1.0278884648668247	0	0.0	2026-08-03T21:54:26.481664+00:00
exp_1785794069550	sweep-MSFT-h10	persistence	success	discard	1.0	1.0	1.0	0	0.0	2026-08-03T21:54:29.550758+00:00
exp_1785794069646	sweep-MSFT-h10	ridge	success	discard	0.948405179361027	0.9958983329502804	1.0404885747528227	0	0.0	2026-08-03T21:54:29.646735+00:00
exp_1785794069719	sweep-MSFT-h10	elastic_net	success	discard	0.9455997159485332	0.9836500321261433	1.0309777071144461	0	0.0	2026-08-03T21:54:29.719922+00:00
exp_1785794072954	sweep-MSFT-h10	compact_mlp	success	discard	1.4680353685280692	1.581488966639081	1.6392652447017122	0	0.0	2026-08-03T21:54:32.954544+00:00
exp_1785794073782	sweep-MSFT-h10	dlinear	success	discard	1.6292317178005877	1.7545603902686095	3.1235580790400577	0	0.0	2026-08-03T21:54:33.782771+00:00
exp_1785794073977	sweep-MSFT-h10	small_tcn	success	discard	0.9466995188054603	1.002359645536155	1.0684235167396194	0	0.0	2026-08-03T21:54:33.977189+00:00
exp_1785794076839	sweep-MSFT-h20	persistence	success	discard	1.0	1.0	1.0	0	0.0	2026-08-03T21:54:36.839134+00:00
exp_1785794076924	sweep-MSFT-h20	ridge	success	keep	0.8578043319299888	0.8357570443382745	0.9485528656332275	0	0.0	2026-08-03T21:54:36.924220+00:00
exp_1785794076991	sweep-MSFT-h20	elastic_net	success	keep	0.9225714295578938	0.884803741527795	1.1704093222775374	0	0.0	2026-08-03T21:54:36.990671+00:00
exp_1785794080629	sweep-MSFT-h20	compact_mlp	success	discard	1.2923238220154416	1.3394421821903246	1.8277776050949242	0	0.0	2026-08-03T21:54:40.629835+00:00
exp_1785794081413	sweep-MSFT-h20	dlinear	success	discard	1.705214267104578	1.765398026474274	3.1514708413072685	0	0.0	2026-08-03T21:54:41.413152+00:00
exp_1785794081581	sweep-MSFT-h20	small_tcn	success	discard	0.9301195764164044	0.8896467103326648	1.041472205926955	0	0.0	2026-08-03T21:54:41.581511+00:00
exp_1785864598515	review-sweep	persistence	success	discard	1.0	1.0	1.0	0	2.1263675689697266	2026-08-04T17:29:58.515639+00:00
exp_1785864600898	review-sweep	ridge	success	discard	1.1166598186877226	1.1002279143158658	1.5541134749906051	0	2.327207088470459	2026-08-04T17:30:00.898789+00:00
exp_1785864603077	review-sweep	elastic_net	success	discard	0.9762528318677625	0.980281779401059	1.0104361616354263	0	2.12864089012146	2026-08-04T17:30:03.077472+00:00
exp_1785864606768	review-sweep	compact_mlp	success	discard	10.589986088021007	11.192846922287712	15.261370409722021	0	3.6394481658935547	2026-08-04T17:30:06.768110+00:00
exp_1785864610763	review-sweep	dlinear	success	discard	5.006920917694809	4.701098954845247	6.512777777667235	0	3.9447996616363525	2026-08-04T17:30:10.763050+00:00
exp_1785864612941	review-sweep	small_tcn	success	discard	0.988392847607311	1.0011531487139402	1.0218777049359589	0	2.125467300415039	2026-08-04T17:30:12.941381+00:00
exp_1785865049380	sweep-QQQ-h5	persistence	success	discard	1.0	1.0	1.0	0	2.125135898590088	2026-08-04T17:37:29.380748+00:00
exp_1785865051660	sweep-QQQ-h5	ridge	success	discard	1.030463447487313	0.9927582332124352	1.2353510682782762	0	2.228807210922241	2026-08-04T17:37:31.660281+00:00
exp_1785865053939	sweep-QQQ-h5	elastic_net	success	discard	0.9760926086448036	0.9902587973939913	1.0086822221678433	0	2.227074146270752	2026-08-04T17:37:33.939113+00:00
exp_1785865054403	sweep-MSFT-h5	persistence	success	discard	1.0	1.0	1.0	0	2.1254754066467285	2026-08-04T17:37:34.403981+00:00
exp_1785865056786	sweep-MSFT-h5	ridge	success	discard	0.9945845291852191	0.9750560804533609	1.4699574432691278	0	2.327944040298462	2026-08-04T17:37:36.786268+00:00
exp_1785865057937	sweep-QQQ-h5	compact_mlp	success	discard	7.398877695517938	8.290846681720394	19.103293078450235	0	3.947580575942993	2026-08-04T17:37:37.937532+00:00
exp_1785865059185	sweep-MSFT-h5	elastic_net	success	discard	0.9846014001373798	0.9773694655772235	1.0148280872050224	0	2.3299548625946045	2026-08-04T17:37:39.185544+00:00
exp_1785865062547	sweep-QQQ-h5	dlinear	success	discard	3.525912200646306	3.449014715883897	6.825985292007283	0	4.556060314178467	2026-08-04T17:37:42.547117+00:00
exp_1785865063811	sweep-MSFT-h5	compact_mlp	success	discard	6.829123679467028	7.019999651487731	30.322873365413887	0	4.571040153503418	2026-08-04T17:37:43.811456+00:00
exp_1785865065641	sweep-QQQ-h5	small_tcn	success	discard	0.9856920353354252	0.9951509289352416	1.0190206359469163	0	3.0424070358276367	2026-08-04T17:37:45.641662+00:00
exp_1785865068337	sweep-MSFT-h5	dlinear	success	discard	3.738334004504105	3.633456617331291	6.268383159304019	0	4.461925506591797	2026-08-04T17:37:48.337117+00:00
exp_1785865070620	sweep-MSFT-h5	small_tcn	success	discard	0.992140075666578	1.000167169651891	1.0236446285508545	0	2.228088855743408	2026-08-04T17:37:50.620002+00:00
exp_1785876126332	confirm2-h20	persistence	success	discard	1.0	1.0	1.0	0	3.978823661804199	2026-08-04T20:42:06.332957+00:00
exp_1785876133332	confirm2-h20	ridge	success	discard	1.1537038814946545	1.1531017583238399	1.5592930717352904	0	6.7546303272247314	2026-08-04T20:42:13.332207+00:00
exp_1785876139012	confirm2-h20	elastic_net	success	keep	0.8130649184843783	0.8613725138643288	0.8838832175149102	0	5.399270534515381	2026-08-04T20:42:19.012931+00:00
exp_1785876143042	confirm2-h20	small_tcn	success	keep	0.8424133149692743	0.8576993150991105	0.9311725276723548	0	3.7932441234588623	2026-08-04T20:42:23.042919+00:00
exp_1785876243989	confirm2-h10	persistence	success	discard	1.0	1.0	1.0	0	3.2561981678009033	2026-08-04T20:44:03.989881+00:00
exp_1785876245669	confirm2-h20	persistence	success	discard	1.0	1.0	1.0	0	3.3616297245025635	2026-08-04T20:44:05.669707+00:00
exp_1785876246801	confirm2-h20	persistence	success	discard	1.0	1.0	1.0	0	3.4723808765411377	2026-08-04T20:44:06.801006+00:00
exp_1785876247687	confirm2-h10	ridge	success	discard	1.0853830138682279	1.185165331470562	1.6108315874823487	0	3.460108518600464	2026-08-04T20:44:07.687934+00:00
exp_1785876249424	confirm2-h20	ridge	success	discard	0.7777221523826437	0.8989459140387621	1.4369804657642231	0	3.4894533157348633	2026-08-04T20:44:09.424960+00:00
exp_1785876250586	confirm2-h20	ridge	success	discard	0.9993639308688032	1.0140875106478144	1.9313080049663554	0	3.569401264190674	2026-08-04T20:44:10.586616+00:00
exp_1785876251525	confirm2-h10	elastic_net	success	keep	0.9381303689249078	0.9494530351625726	1.0047019001146917	0	3.6649246215820312	2026-08-04T20:44:11.525791+00:00
exp_1785876253174	confirm2-h20	elastic_net	success	keep	0.7874487690821391	0.8571515162489968	0.9690782872515625	0	3.5644185543060303	2026-08-04T20:44:13.174277+00:00
exp_1785876254344	confirm2-h20	elastic_net	success	keep	0.9225714295578938	0.884803741527795	1.1704093222775374	0	3.5673444271087646	2026-08-04T20:44:14.344391+00:00
exp_1785876255198	confirm2-h10	small_tcn	success	discard	0.9672041801043355	1.0056203870728988	1.0207996126559362	0	3.463757038116455	2026-08-04T20:44:15.198663+00:00
exp_1785876256745	confirm2-h20	small_tcn	success	keep	0.8569166419327856	0.9137051292670155	1.0180499018128675	0	3.361100196838379	2026-08-04T20:44:16.745882+00:00
exp_1785876257802	confirm2-h20	small_tcn	success	keep	0.9301195764164044	0.8896467103326648	1.0196465623070343	0	3.2613275051116943	2026-08-04T20:44:17.802758+00:00
exp_1785876274899	confirm2-h10	persistence	success	discard	1.0	1.0	1.0	0	3.056447982788086	2026-08-04T20:44:34.899872+00:00
exp_1785876276093	confirm2-h10	persistence	success	discard	1.0	1.0	1.0	0	3.1679611206054688	2026-08-04T20:44:36.093737+00:00
exp_1785876278168	confirm2-h10	ridge	success	discard	0.965902092486123	0.9988888286480077	1.3843583785636864	0	3.056642532348633	2026-08-04T20:44:38.168872+00:00
exp_1785876279433	confirm2-h10	ridge	success	discard	1.030142486998467	1.0004941343051938	1.742582489440761	0	3.160249710083008	2026-08-04T20:44:39.433923+00:00
exp_1785876281630	confirm2-h10	elastic_net	success	discard	0.9333643431575641	0.9887078071557283	1.0620684669398697	0	3.2676637172698975	2026-08-04T20:44:41.630041+00:00
exp_1785876282988	confirm2-h10	elastic_net	success	discard	0.9455997159485332	0.9836500321261433	1.0309777071144461	0	3.3553357124328613	2026-08-04T20:44:42.988188+00:00
exp_1785876285094	confirm2-h10	small_tcn	success	discard	0.9474201700054211	1.0018751778087163	1.1045818786692325	0	3.2615113258361816	2026-08-04T20:44:45.094783+00:00
exp_1785876286425	confirm2-h10	small_tcn	success	discard	0.9466995188054603	0.9972467685230672	1.0695931038537068	0	3.2566006183624268	2026-08-04T20:44:46.425616+00:00
exp_1785876382636	holdout2-h20	elastic_net	success	discard	0.8852356554072142	0.9151413871347717	0.9556921833717047	0	0.0	2026-08-04T20:46:22.636721+00:00
exp_1785876382764	holdout2-h20	elastic_net	success	keep	0.9065783002484568	0.9237015620149305	0.9608755544730504	0	0.0	2026-08-04T20:46:22.764835+00:00
exp_1785876382896	holdout2-h20	elastic_net	success	discard	0.9432305517513904	0.9665791447285526	1.1175588520275062	0	0.0	2026-08-04T20:46:22.896701+00:00
exp_1785876383115	holdout2-h20	small_tcn	success	keep	0.8903934714658492	0.9156386809089888	0.9580573093154819	0	0.0	2026-08-04T20:46:23.115811+00:00
exp_1785876383321	holdout2-h20	small_tcn	success	keep	0.889438945712629	0.8946479142058165	0.928332844619781	0	0.0	2026-08-04T20:46:23.321557+00:00
exp_1785876383494	holdout2-h20	small_tcn	success	discard	0.9657609411953265	1.02651931213457	1.2259704525912782	0	0.0	2026-08-04T20:46:23.494120+00:00
exp_1785876383599	holdout2-h20	elastic_net	success	discard	0.9507647782462916	0.9624702895418414	0.9842220983141252	0	0.0	2026-08-04T20:46:23.599153+00:00
exp_1785880656138	grid-SPY-h20	elastic_net_a001_l1	success	discard	1.107741164920817	1.087781844551731	1.6234732272388535	0	3.6570215225219727	2026-08-04T21:57:36.138502+00:00
exp_1785880659369	grid-SPY-h20	elastic_net_a001_l5	success	discard	1.047638136189727	1.0541620343254978	1.5105640963507023	0	3.1468167304992676	2026-08-04T21:57:39.369205+00:00
exp_1785880659372	grid-QQQ-h20	elastic_net_a001_l5	success	discard	1.008778326823391	0.9862946452433233	1.0762182239841687	0	3.147353172302246	2026-08-04T21:57:39.372760+00:00
exp_1785880662608	grid-QQQ-h20	elastic_net_a001_l15	success	discard	0.9838054790056794	0.9816155873529319	1.0098524420496917	0	3.1594326496124268	2026-08-04T21:57:42.608564+00:00
exp_1785880665838	grid-QQQ-h20	elastic_net_a01_l1	success	discard	0.9941237693301204	0.9974979854266227	1.0132622936408067	0	3.1462454795837402	2026-08-04T21:57:45.838534+00:00
exp_1785880668974	grid-SPY-h20	elastic_net_a03_l1	success	discard	1.0024181876688851	1.0104361616354263	1.03198476868542	0	3.0438268184661865	2026-08-04T21:57:48.974223+00:00
exp_1785880672202	grid-SPY-h20	elastic_net_a10_l1	success	discard	0.9762528318677625	0.980281779401059	1.0104361616354263	0	3.149869441986084	2026-08-04T21:57:52.202821+00:00
exp_1785880675324	grid-SPY-h20	elastic_net_a30_l1	success	discard	0.9762528318677625	0.980281779401059	1.0104361616354263	0	3.04439115524292	2026-08-04T21:57:55.324473+00:00
exp_1785880675325	grid-QQQ-h20	elastic_net_a30_l1	success	discard	0.9760926086448036	0.9902587973939913	1.0086822221678433	0	3.0449044704437256	2026-08-04T21:57:55.325482+00:00
exp_1785880678336	grid-SPY-h20	elastic_net_a100_l1	success	discard	0.9762528318677625	0.980281779401059	1.0104361616354263	0	2.9396519660949707	2026-08-04T21:57:58.336439+00:00
exp_1785880678344	grid-QQQ-h20	elastic_net_a100_l1	success	discard	0.9760926086448036	0.9902587973939913	1.0086822221678433	0	2.9413070678710938	2026-08-04T21:57:58.344106+00:00
